2,00503E+11;2005;3;30;;0;;217;United States;1;North America;Indiana;Bloomington;39.16659;-86.534244;1;0;Fire ignited in cement vestibule and bullet fired through front door;3/30/2005: Unknown perpetrators fired a bullet through the front door and ignited a small fire within the Planned Parenthood of Indiana in Bloomington, United States.  There were no casualties but the abortion clinic sustained minor damages.;1;1;1;0;;.;0;1;0;7;Facility/Infrastructure Attack;;.;;.;5;Abortion Related;40;Clinics;Planned Parenthood;Planned Parenthood of Indiana;217;United States;;.;;.;;;;.;;.;;.;;;;.;Anti-Abortion Activists;;;;;1470;;;;To protest the practice of abortion and to sabotage abortion facilities operating in Indiana.;0;;;-99;-99;0;;.;;;.;;;.;;8;Incendiary;18;Arson/Fire;5;Firearms;5;Unknown Gun Type;;.;;.;;.;;.;;0;0;0;0;0;0;1;3;Minor (likely < $1 million);;Glass shattered and the fire caused minimal damage;0;;;;;;;0;;;;;;;.;;The fire burnt itself out on its own.  Two weeks earlier, there was a similar attack against the same abortion clinic (200503190014).;"""Fire Causes Little Damage at Bloomington Planned Parenthood,"" Associated Press, March 31, 2005.";"""2005 Chronicle of Clinic Violence & Harassment,"" Planned Parenthood Federation of America, Inc.";;Anti-Abortion Project 2010;-9;-9;0;-9;
2,00504E+11;2005;4;13;;0;;217;United States;1;North America;Massachusetts;New Bedford;41.637675;-70.930869;1;0;;04/13/2005: At approximately 1:15 a.m. local time, an improvised explosive device (IED) was detonated on the grounds of an elementary school in New Bedford, Massachusetts, United States. No casualties and only minor property damage resulted from this incident. No group claimed responsibility for this attack, although two men were seen fleeing the scene moments before the explosion.;1;1;1;0;;.;0;1;0;3;Bombing/Explosion;;.;;.;8;Educational Institution;49;School/University/Educational Building;Unknown;John B. DeValles Elementary School;217;United States;;.;;.;;;;.;;.;;.;;;;.;Unknown;;;;;-9;;;;Unknown;0;;;2;0;0;;.;;;.;;;.;;6;Explosives/Bombs/Dynamite;17;Other Explosive Type;;.;;.;;.;;.;;.;;.;An IED was detonated.;0;0;0;0;0;0;1;3;Minor (likely < $1 million);-99;;0;;;;;;;;;;;;;;.;;;EXPLOSION NEAR ELEMENTARY SCHOOL PROBED, The Boston Globe, April 14, 2005.;;;CETIS;-9;-9;0;-9;
2,00504E+11;2005;4;13;;0;;217;United States;1;North America;Washington;Sammamish;47.613435;-122.035494;1;0;;04/13/2005: A home under construction in Sammamish, Washington in the United States was firebombed, suspectedly by the Earth Liberation Front (ELF).  The arson caused $100,000 in damages to the home's garage where the device was planted, but there were no injuries in the incident.  The incident appears to be related to an attempted firebombing of another home a few blocks away, which was claimed in a note, and both incidents were posted on the ELF website. Despite the claims and that the devices were similar to those used in the Snohomish county home arsons in 2004, authorities were unable to confirm ELF as the perpetrators.;1;1;1;0;;.;1;1;0;7;Facility/Infrastructure Attack;;.;;.;14;Private Citizens & Property;76;House/Apartment/Residence;private home;home under construction in Sammamish, WA;217;United States;;.;;.;;;;.;;.;;.;;;;.;Earth Liberation Front (ELF);;;;;20147;;;;Anti-land development;;;;;;;;;;;;;;;;;;;;;;;;;;;;;;;;;;;;;;;;;;;;;;;;;;;;;;;;;;;;;;;;;;;;;
2,00504E+11;2005;4;13;;0;;217;United States;1;North America;Washington;Sammamish;47.613435;-122.035494;1;0;;"04/13/2005: Unknown perpetrators attempted to firebomb a home on Inglewood Hill Road in Sammamish, Washington in the United States.  The incendiary malfunctioned because the fuse blew out before the device ignited.  A motorist driving past the home in the morning, spotted the failed incendiary with a note next to it, reading ""Where are all the trees. Burn Rapist Burn. ELF.""  There were no casualties in the incident, nor damages. The incident appears to be related to a firebombing of another home a few blocks away on the same day, and both incidents were posted on the ELF website. Despite the claims and that the devices were similar to those used in the Snohomish county home arsons in 2004, authorities were unable to confirm ELF as the perpetrators.";1;1;1;0;;.;1;0;0;7;Facility/Infrastructure Attack;;.;;.;14;Private Citizens & Property;76;House/Apartment/Residence;private home;home under construction in Sammamish, WA;217;United States;;.;;.;;;;.;;.;;.;;;;.;Earth Liberation Front (ELF);;;;;20147;;;;Anti-land development;;;;;;;;;;;;;;;;;;;;;;;;;;;;;;;;;;;;;;;;;;;;;;;;;;;;;;;;;;;;;;;;;;;;;
2,00505E+11;2005;5;5;;0;;217;United States;1;North America;New York;New York City;40.712784;-74.005941;1;0;;05/05/2005: Unidentified perpetrators threw two small, homemade grenades at a building housing the British Consulate in New York City, New York, United States. No one was harmed in the attack, but the building sustained some minor damage. No group claimed responsibility for the attack.;1;1;1;0;;.;0;1;0;3;Bombing/Explosion;;.;;.;7;Government (Diplomatic);46;Embassy/Consulate;British Consulate;The office of the British Consulate in New York City;216;Great Britain;14;Private Citizens & Property;67;Unnamed Civilian/Unspecified;Civilians;New York City civilians;217;United States;;.;;.;;;;.;Unknown;;;;;-9;;;;Unknown;0;;;;0;0;;.;;;.;;;.;;6;Explosives/Bombs/Dynamite;7;Grenade;;.;;.;;.;;.;;.;;.;The two grenades used in the attack were homemade.;0;0;0;0;0;0;1;3;Minor (likely < $1 million);-99;There was minor damage to the exterior of the building.;0;;;;;;;;;;;;;;.;;The attack occurred on the same day as Britain's national elections.;Tom Hays, Grenades Damage British Consulate in N.Y., The Associated Press, May 05, 2005.;Police Questions Man about British Consulate Blast, Xinhua General News Service, May 05, 2005.;James Bone, Michael Evans and Stewart Tendler, Attack on New York Consulate a Reminder of Threat, The Times, May 06, 2005.;CETIS;-9;-9;1;1;
2,00507E+11;2005;7;4;;0;;217;United States;1;North America;Florida;West Palm Beach;26.714388;-80.052689;1;0;;7/4/2005: Unknown perpetrators ignited a fire at the Presidential Women's Center in West Palm Beach, Florida, United States.  There were no casualties, but the abortion clinic sustained moderate damage.;1;1;1;0;;.;0;1;0;7;Facility/Infrastructure Attack;;.;;.;5;Abortion Related;40;Clinics;;Presidential Women's Center;217;United States;;.;;.;;;;.;;.;;.;;;;.;Anti-Abortion Activists;;;;;1470;;;;To protest the practice of abortion and to sabotage abortion facilities operating in Florida.;0;;;-99;-99;0;;.;;;.;;;.;;8;Incendiary;20;Gasoline or Alcohol;;.;;.;;.;;.;;.;;.;Fire ignited with some type of accelerant believed possibly to be lighter fluid;0;0;0;0;0;0;1;3;Minor (likely < $1 million);;Moderate water, smoke, and fire damage.;0;;;;;;;0;;;;;;;.;;The fire was first reported at 10:45 PM.  A fire was set at another abortion clinic in Palm Beach County one year before this incident (200407020005).  In the ten years before the attack, the abortion clinic was the target of weekly protests.;"Jill Barton, ""Suspicious Fire Damages Florida Abortion Clinic,"" Associated Press, July 5, 2005.";"Leon Fooksman and Peter Franceschina, ""Abortion Clinic Fire Suspicious,"" Sun Sentinel, July 6, 2005.";"Clinic Defense and Research, ""1997 Chronicle of Clinic Harassment & Violence,"" Planned Parenthood Federation of America, Inc.";Anti-Abortion Project 2010;-9;-9;0;-9;
2,00507E+11;2005;7;8;;0;;217;United States;1;North America;New Hampshire;Berlin;44.46867;-71.185077;1;1;in Success, NH;07/08/2005: Unknown perpetrator(s) set arson to logging equipment owned by T.R. Dillon Logging in Success, New Hampshire in the United States, causing $500,000 in damages.  There were no casualties in the incident.  It was unclear whether this was an act against logging or if it was committed by local environmentalists or merely vandals.  Three vehicles, an all-wheel drive plow truck, a brand new 18-wheel tractor-trailer and an excavator, were engulfed in flames when the fire department responded to the incident.;1;1;1;1;2;Other Crime Type;0;1;0;7;Facility/Infrastructure Attack;;.;;.;1;Business;5;Industrial/Textiles/Factory;T.R. Dillon Logging;three logging vehicles owned by T.R. Dillon Logging in Success, NH;217;United States;;.;;.;;;;.;;.;;.;;;;.;Unknown;;;;;-9;;;;Unknown;0;;;-99;-99;0;;.;;;.;;;.;;8;Incendiary;18;Arson/Fire;;.;;.;;.;;.;;.;;.;;0;0;0;0;0;0;1;3;Minor (likely < $1 million);500000;three logging vehicles destroyed;0;;;;;;;0;;;;;;;.;;This was not the first time T.R. Dillon logging was targeted by arsonists. There was another incident on New Year's Day of the same year.;"Carol Robidoux, ""Another arson at NH logging site,"" The Union Leader, July 10, 2005.";"""USAT States Pages,"" Associated Press, July 10, 2005.";;Eco Project 2010;-9;-9;0;-9;
2,00509E+11;2005;9;0;;0;;217;United States;1;North America;California;Los Angeles;34.05349;-118.245319;1;0;at residence of Guerdon Stuckey, the  Animal Services General Manager;09/00/2005: Members of the Animal Liberation Front (ALF) claimed responsibility for ignited smoke grenades in the lobby of the residence of Guerdon Stuckey, the  Animal Services General Manager in Los Angeles, California in the United States.  There were no injuries, and the extent of property damage is unknown, if any.  The Animal Defense League and other groups had been appealing for months to the mayor to oust Stuckey from office and go ahead with a no-kill policy at city animal shelters, but they were not seeing desired results.;1;1;1;0;;.;0;1;0;7;Facility/Infrastructure Attack;;.;;.;2;Government (General);18;Government Personnel (excluding police, military);Animal Services Department;Guerdon Stuckey, Animal Services Director;217;United States;;.;;.;;;;.;;.;;.;;;;.;Animal Liberation Front (ALF);;;;;291;;;;To remove Guerdon Stuckey from his position and implement a no-kill policy at city animal shelters.;0;;;-99;-99;1;10;Unknown;;;.;;;.;;8;Incendiary;;.;;.;;.;;.;;.;;.;;.;smoke bomb;0;0;0;0;0;0;-9;;.;;;0;;;;;;;0;;;;;;;.;;;"Rick Orlov, ""At-Home Security OK'D For Workers,"" The Daily News of Los Angeles, October 20, 2005.";"""News briefs from California,"" Associated Press, October 22, 2005.";"David Zahniser, ""Fired animal services exec challenges termination,"" Copley News Service, December 21, 2005.";Eco Project 2010;0;1;0;1;
2,00511E+11;2005;11;20;;0;;217;United States;1;North America;Maryland;Hagerstown;39.6425;-77.717579;1;0;;11/20/2005: Perpetrators set four separate fires in the development known as Hagers Crossing in Hagerstown, Maryland, United States, a short time before 2:30 a.m. local time. One townhouse was destroyed and three others were damaged. No casualties occurred. Earth Liberation Front (ELF) claimed responsibility for these attacks.;1;1;1;0;;.;0;1;0;3;Bombing/Explosion;;.;;.;14;Private Citizens & Property;75;Village/City/Town/Suburb;Unknown;the development known as Hagers Crossing in Hagerstown, Maryland;217;United States;;.;;.;;;;.;;.;;.;;;;.;Earth Liberation Front (ELF);;;;;20147;;;;"In an emailed statement, an individual that claimed to be a member of ELF wrote that the goal of these attacks was  ""to strike at the bottom line"" of Ryan Homes, which was the developer of many of the houses in the plan.";0;;;0;0;1;4;E-mail;;;.;;;.;-9;8;Incendiary;18;Arson/Fire;;.;;.;;.;;.;;.;;.;;0;0;0;0;0;0;1;3;Minor (likely < $1 million);300000;The value of property damage was estimated by the local fire chief, Chief Gary R. Hawbaker.;0;;;;;;;;;;;;;;.;;Although the individual that wrote the email claiming responsibility for these attacks declared himself to be a member of ELF, the veracity of his statement could not be determined to be true or false. If this was the work of ELF, these collective incidents would be the first attacks perpetrated by ELF in Maryland.;Arsonists destroy one home, damage three others in development, The Associated Press State & Local Wire, November 20, 2005.;Nelson Hernandez, Arsons May Be Work of Activists;;;;;;;
2,00511E+11;2005;11;29;;0;;217;United States;1;North America;California;San Diego;32.715695;-117.161719;1;0;;11/29/2005: In a series of related incidents, unknown perpetrators carried out incendiary attacks on two separate car dealerships in San Diego, United States,Collectively, the value of the property damage from these related incidents was approximately $167,000. In this particular attack, at 2:45 a.m. local time, Pacific Nissan car dealership was targeted and five sport utility vehicles (SUVs) were set on fire, which resulted in approximately $150,000 in property damage. No casualties resulted from this incident and although no group claimed responsibility, authorities suspect Earth Liberation Front (ELF).;1;1;1;0;;.;1;1;0;3;Bombing/Explosion;;.;;.;1;Business;7;Retail/Grocery/Bakery;Unknown;Pacific Nissan car dealership;217;United States;;.;;.;;;;.;;.;;.;;;;.;Earth Liberation Front (ELF);;;;;20147;;;;Unknown;0;;;0;0;0;;.;;;.;;;.;;8;Incendiary;18;Arson/Fire;;.;;.;;.;;.;;.;;.;;0;0;0;0;0;0;1;3;Minor (likely < $1 million);150000;;0;;;;;;;;;;;;;;.;;Although no group claimed responsibility, authorities suspect Earth Liberation Front (ELF).;Joe Hughes, Arson razes luxury vehicles;;;;;;;;
2,00511E+11;2005;11;29;;0;;217;United States;1;North America;California;San Diego;32.715695;-117.161719;1;0;;11/29/2005: In a series of related incidents, unknown perpetrators carried out incendiary attacks on two separate car dealerships in San Diego, California, United States. Collectively, the value of the property damage from these related incidents was approximately $167,000. In this particular attack, at 3:00 a.m. local time, Guy Hill Cadillac car dealership was targeted and two sport utility vehicles (SUVs) were sent on fire, which resulted in approximately $17,000 in property damage. No casualties resulted from this incident and although no group claimed responsibility, authorities suspect Earth Liberation Front (ELF).;1;1;1;0;;.;1;1;0;3;Bombing/Explosion;;.;;.;1;Business;7;Retail/Grocery/Bakery;Unknown;Guy Hill Cadillac car dealership;217;United States;;.;;.;;;;.;;.;;.;;;;.;Earth Liberation Front (ELF);;;;;20147;;;;Unknown;0;;;;;0;;.;;;.;;;.;;8;Incendiary;18;Arson/Fire;;.;;.;;.;;.;;.;;.;;0;0;0;0;0;0;1;3;Minor (likely < $1 million);17000;;0;;;;;;;;;;;;;;.;;Although no group claimed responsibility, authorities suspect Earth Liberation Front (ELF).;Joe Hughes, Arson razes luxury vehicles;;;;;;;;
2,00512E+11;2005;12;20;;0;;217;United States;1;North America;Ohio;Cincinnati;39.150174;-84.518436;1;0;3668 Clifton Avenue  Cincinnati, OH 45220;12/20/2005: A few hours after evening prayer, two pipe bombs exploded outside of the Islamic Association of Cincinnati, a mosque in Cincinnati, Ohio, United States.  No claim of responsibility was made.  No arrests have been made.;1;1;1;0;;.;0;1;0;3;Bombing/Explosion;;.;;.;15;Religious Figures/Institutions;86;Place of Worship;Mosque;Islamic Association of Cincinnati;217;United States;;.;;.;;;;.;;.;;.;;;;.;Unknown;;;;;-9;;;;While the motive for this attack is unknown, a number of threats have been made against this mosque.  The threats have attacked the religon in general.;0;;;-99;0;0;;.;;;.;;;.;;6;Explosives/Bombs/Dynamite;17;Other Explosive Type;;.;;.;;.;;.;;.;;.;Pipebomb;0;0;0;0;0;0;1;4;Unknown;;No information given on the extent of the damage done to the mosqu or surounding area.;0;;;;;;;;;;;;;;.;;;"""Clerfy, officials condemn Ohio mosque bombing,"" Associated Press, December 21, 2005";"""FBI notes fourth anniversary of bombing at Islamic Association of Cincinnati,"" US Fed News, December 18, 2009.";;UMD Miscellaneous;-9;-9;0;-9;
2,00601E+11;2006;1;17;;0;;217;United States;1;North America;Washington;Camano;48.173986;-122.528214;1;0;;01/17/2006: A $3 million dollar home under construction on Camano Island near Seattle, Washington, United States, was completely destroyed in an arson attack. The home belonged to Karla and Mark Verbarendse. There were no casualties and the Earth Liberation Front claimed responsibility.;1;1;1;0;;.;0;1;0;7;Facility/Infrastructure Attack;;.;;.;14;Private Citizens & Property;76;House/Apartment/Residence;Unknown;House belonging to Karla and Mark Verbarendse;217;United States;;.;;.;;;;.;;.;;.;;;;.;Earth Liberation Front (ELF);;;;;20147;;;;Unknown;0;;;;0;1;5;Note left at scene;;;.;;;.;-9;8;Incendiary;18;Arson/Fire;;.;;.;;.;;.;;.;;.;;0;0;0;0;0;0;1;2;Major (likely > $1 million but < $1 billion);;;0;;;;;;;;;;;;;;.;;;Terrorism: Criminal Nature, The Seattle Post-Intelligencer, January 19, 2006.;Kaitlin Manry, Ecoterrorism Fire Victims Rebuild, Move On ELF Claimed Responsibility for Camano Home Blaze, The Seattle Post-Intelligencer, August 14, 2006.;Nancy Bartley, Fed Agency Probes Bainbridge Fire, The Seattle Times, June 28, 2006.;CETIS;0;1;0;1;
2,00603E+11;2006;3;3;;0;;217;United States;1;North America;North Carolina;Chapel Hill;35.904912;-79.046913;1;0;"""The Pit"" on the University of North Carolina campus";"3/3/2006: Mohammed Reza Taheri-azar rented a Jeep Cherokee and drove it through a crowed of people gathered in ""The Pit"" on the University of North Carolina- Chapel Hill campus in North Carolina, United States.  His intention was to hurt or kill people in order to ""avenge the deaths of Muslims around the world.""  He was acting alone.  Although he was born in Iran, he was raised in the United States and was a citizen of the United States.";1;1;1;0;;.;0;1;0;8;Unarmed Assault;;.;;.;14;Private Citizens & Property;70;Student;Students;"Students gathered the University of North Carolina campus in an area called ""The Pit""";217;United States;;.;;.;;;;.;;.;;.;;;;.;Unaffiliated Individual(s);;;;;20202;;;;"Mohammed Reza Taheri-azar wanted to hurt people in order to ""avenge the deaths of Muslims around the world.""";0;;;1;1;1;8;Personal claim;;;.;;;.;0;10;Vehicle (not to include vehicle-borne explosives, i.e., car or truck bombs);;.;;.;;.;;.;;.;;.;;.;"The individual drove a Jeep Cherokee into a group of students gathered in an area known as ""The Pit"".";0;0;0;9;0;0;0;;.;;;0;;;;;;;;;;;;;;.;;"The individual drove his rented Jeep Cherokee into a common gathering area, with the intention of killing people, in order to  ""avenge the deaths of Muslims around the world.""  He was born in Iran, but grew up in the United States and became a full U.S. citizen in 1991. He appears to have acted alone.";"Karin Rives, ""UNC attacker sought revenge";;;;;;;;
2,00606E+11;2006;6;30;;0;;217;United States;1;North America;California;Los Angeles;34.100246;-118.459463;1;0;Bel Air;06/30/2006: An incendiary device that consisted of 'a bottle filled with a flammable liquid' was mistakenly left on the doorstep of a 70 year old Bel Air, California, United States, resident on June 30, 2006. The intended recipient was Lynn Fairbanks, a University of California  Los Angeles (UCLA) professor of psychiatry and behavioral sciences who was also a neighbor of the victim. Since the bomb failed to detonate, no casualties resulted from this attack. Animal Liberation Front (ALF) claimed responsibility for this incident.;1;1;1;0;;.;0;0;0;3;Bombing/Explosion;;.;;.;8;Educational Institution;48;Teacher/Professor/Instructor;Unknown;Lynn Fairbanks, a University of California  Los Angeles (UCLA) professor of psychiatry and behavioral sciences;217;United States;;.;;.;;;;.;;.;;.;;;;.;Animal Liberation Front (ALF);;;;;291;;;;"In a statement posted on its website, ALF claimed that Fairbanks and her team were ""breeding monkeys for painful addiction experiments"".";0;;;;;1;7;Posted to website, blog, etc.;;;.;;;.;;8;Incendiary;18;Arson/Fire;;.;;.;;.;;.;;.;;.;;0;0;0;0;0;0;0;;.;;;0;;;;;;;;;;;;;;.;;;City News Service, July 12, 2006.;ANIMAL LIBERATION GROUP TAKES RESPONSIBILITY FOR TERRORIST ATTACK ON ELDERLY WOMAN WHO WAS UNINTENDED TARGET - REWARD FOR INFORMATION OFFERED, US Fed News, July 12, 2006.;Julia Erlandson & Daily Bruin, Group claims it attempted bombing of UCLA faculty member's home, University Wire, July 17, 2006.;CETIS;0;1;0;1;
2,00607E+11;2006;7;12;;0;;217;United States;1;North America;California;Los Angeles;34.100246;-118.459463;1;0;Bel Air;07/12/2006:The Animal Liberation Front (ALF) accidentally targeted an elder woman's house with a bomb in Bel Air, California, United States. The device failed to go off but authorities stressed that had it detonated it is very likely that the woman would have been killed.;1;1;1;0;;.;0;0;0;3;Bombing/Explosion;;.;;.;14;Private Citizens & Property;;.;Unknown;Unknown;217;United States;;.;;.;;;;.;;.;;.;;;;.;Animal Liberation Front (ALF);;;;;291;;;;Unknown;0;;;;0;1;10;Unknown;;;.;;;.;-9;6;Explosives/Bombs/Dynamite;16;Unknown Explosive Type;;.;;.;;.;;.;;.;;.;;0;0;0;0;0;0;0;;.;;;0;;;;;;;;;;;;;;.;;;Animal Liberation group takes responsibility for terrorist attack on elderly woman who was unintended target- Reward for information Offered. US Fed News.  July 12, 2006.;;;CETIS;0;1;0;1;
2,00607E+11;2006;7;28;;0;;217;United States;1;North America;Washington;Seattle;47.60356;-122.329439;1;0;;7/28/2006: Naveed Afzal Haq forced his way into Jewish Federation of Greater Seattle, headquarters of the philanthropic organization, building by holding a gun to the head of a teenage girl.  He then shot 6 women working there, killing one of them and injuring the other five.  One of the victims called 911. Dispatchers calmed Haq and he exited the building with his hands on his head, where police arrested him.;1;1;1;1;2;Other Crime Type;0;1;0;2;Armed Assault;;.;;.;1;Business;;.;Jewish Philanthropic Organization;Jewish Federation of Greater Seattle;217;United States;;.;;.;;;;.;;.;;.;;;;.;Unaffiliated Individual(s);;;;;20202;;;;"Upon entering the building, Naveed Afzal Haq stated, ""I'm Muslim American.  I'm angry at Israel.""  He also stated to a 911 dispatcher that, ""These are Jews and I'm tired of getting pushed around and our people getting pushed around by the situation in the Middle East.""";0;;;1;1;1;8;Personal claim;;;.;;;.;0;5;Firearms;3;Handgun;;.;;.;;.;;.;;.;;.;;1;1;0;5;0;0;0;;.;;;0;;;;;;;;;;;;;;.;;The mental state of the individual has been questioned.  He has been arrested in the past for indecent exposure and had a history of mental problems.;"Sharyn L. Decker, ""Multiple Charges Filed in Seattle Shootings Six were Attacked at Jewish Center"", The Washington Post, July 30, 2006.";"Toby Harden, ""Muslim shoots six in the US and blames Israel"", The Sunday Telegraph, July 30, 2006.";"Stuart Winter, ""Women are shot by gunman in rampage against US Jews"", Sunday Express, July 30, 2006.";UMD Miscellaneous;-9;-9;0;-9;
2,00609E+11;2006;9;11;;0;;217;United States;1;North America;Iowa;Davenport;41.523505;-90.577549;1;0;;09/11/2006: At approximately 4:30 a.m. local time, an individual drove his vehicle into the Edgerton Women's Health Center in Davenport, Iowa, United States, and subsequently set the vehicle on fire. David Robert McMenemy of Michigan was arrested, charged with arson against a business affecting interstate commerce, and sentenced to five years in prison for committing this attack. McMenemy mistakenly thought that this facility performed abortions. No proof was revealed that McMenemy was associated with any anti-abortion group. No casualties resulted from this attack, although property damage did occur. No group claimed responsibility for the attack.;1;1;1;0;;.;0;1;0;7;Facility/Infrastructure Attack;;.;;.;1;Business;6;Medical/Pharmaceutical;Unknown;Edgerton Women's Health Center;217;United States;;.;;.;;;;.;;.;;.;;;;.;Unaffiliated Individual(s);;;;;20202;;;;McMenemy mistakenly thought that this facility performed abortions.;0;;;1;1;1;8;Personal claim;;;.;;;.;;10;Vehicle (not to include vehicle-borne explosives, i.e., car or truck bombs);;.;8;Incendiary;20;Gasoline or Alcohol;;.;;.;;.;;.;;0;0;0;0;0;0;1;3;Minor (likely < $1 million);;;0;;;;;;;;;;;;;;.;;;Man accused of ramming car into women's clinic in Davenport, The Associated Press State & Local Wire, September 12, 2006.;Detroit man gets 5 years for burning Davenport women's clinic, The Associated Press State & Local Wire, June 30, 2007.;;CETIS;-9;-9;0;-9;
