1,99512E+11;1995;12;19;;0;;217;United States;1;North America;Ohio;Sylvania;41.715575;-83.704249;1;0;;12/19/1995: Three members of the Aryan Republican Army robbed the Mid-America Bank in Sylvania, Ohio, United States.  $7,400 was stolen.;1;0;1;1;2;Other Crime Type;0;1;0;5;Hostage Taking (Barricade Incident);;.;;.;1;Business;3;Bank/Commerce;Mid-America Bank;Mid-America Bank, Sylvania Ohio;217;United States;;.;;.;;;;.;;.;;.;;;;.;Aryan Republican Army;;;;;10005;;;;The Aryan Republican Army robbed banks to simultaneously dispose the state of capital and to provide logistical support for their revolutionary war to overthrow the United States  government.  The money from the bank robberies was used to purchase guns, vehicles, and safehouses.  A portion of the money was also donated to various right-wing extremist causes.  This incident also commemorated the Oklahoma City Bombing.;0;;;3;3;0;;.;;;.;;;.;;5;Firearms;3;Handgun;;.;;.;;.;;.;;.;;.;Glock .45 caliber handgun;0;0;0;0;0;0;1;3;Minor (likely < $1 million);7400;Money stolen;0;;;;;;;0;;;;;;;.;;It is unknown if a fake bomb and/or smoke grenade were used in this robbery.;"Mark S. Hamm, ""In Bad Company: America's Terrorist Underground,"" Northeastern University Press, 2002.";"""Kehoes Linked To Gang,"" Dayton Daily News, March 23, 1998.";"""Two Get Jail in Supremacist Plot,"" Reading Eagle, March 14, 1998.";Hewitt Project;0;0;0;0;
1,99512E+11;1995;12;24;;0;;217;United States;1;North America;Oregon;Eugene;44.04992;-123.088544;1;0;The incident occurred on Grant Street.;12/24/1995: Member of the Animal Liberation Front (ALF), Kevin Tubbs, placed three timed incendiary devices on three ice cream trucks at the Dutch Girl Dairy ice cream shop in Eugene, Oregon in the United States.  Two of the devices, all of which were made of one-liter plastic bottles filled with a flammable liquid and a timing device, consisting of paper matches wrapped around an incense stick which was placed into a fuel-soaked kitchen sponge, ignited two trucks.  The third device malfunctioned and was discovered in the wheel of the truck after a security guard and the fire department extinguished the first two fires;;;;;;;;;;;;;;;;;;;;;;;;;;;;;;;;;;;;;;;;;;;;;;;;;;;;;;;;;;;;;;;;;;;;;;;;;;;;;;;;;;;;;;;;;;;;;;;;;;;;;;;;;;;;;;;;;;;;;;
1,99601E+11;1996;1;1;;0;;217;United States;1;North America;Alabama;Opelika;32.6505;-85.380649;1;0;;;1;1;1;0;;.;0;1;0;1;Assassination;;.;;.;15;Religious Figures/Institutions;85;Religious Figure;;Episcopal Priest;217;United States;;.;;.;;;;.;;.;;.;;;;.;Unknown;;;;;-9;;;;;0;;;;;;;.;;;.;;;.;;6;Explosives/Bombs/Dynamite;16;Unknown Explosive Type;;.;;.;;.;;.;;.;;.;Explosive;0;;;1;1;;1;;.;;;0;;;;;;;0;;;;;;;.;;;;;;PGIS;-9;-9;0;-9;
1,99601E+11;1996;1;1;;0;;217;United States;1;North America;Oregon;Grants Pass;42.44321;-123.324639;1;0;;;1;1;1;-9;;.;0;0;0;7;Facility/Infrastructure Attack;;.;;.;5;Abortion Related;40;Clinics;Planned Parenthood of SW Oregon;Clinic;217;United States;;.;;.;;;;.;;.;;.;;;;.;Unknown;;;;;-9;;;;;0;;;;;;;.;;;.;;;.;;8;Incendiary;;.;;.;;.;;.;;.;;.;;.;;0;;;0;;;1;;.;;;0;;;;;;;0;;;;;;;.;;;;;;PGIS;-9;-9;0;-9;
1,99601E+11;1996;1;5;;0;;217;United States;1;North America;District of Columbia;Washington;38.89037;-77.031959;1;0;;;1;1;1;-9;;.;0;1;0;2;Armed Assault;;.;;.;14;Private Citizens & Property;77;Laborer (General)/Occupation Identified;;Attorney representing widow of Leftist guerilla;217;United States;;.;;.;;;;.;;.;;.;;;;.;Unknown;;;;;-9;;;;;0;;;;;;;.;;;.;;;.;;8;Incendiary;;.;;.;;.;;.;;.;;.;;.;Incendiary;0;;;0;;;1;;.;;;0;;;;;;;0;;;;;;;.;;;;;;PGIS;-9;-9;0;-9;
1,99601E+11;1996;1;12;;0;;217;United States;1;North America;Virginia;Virginia Beach;36.848311;-75.979278;1;0;;1/12/1996: Unknown perpetrators sent a mail bomb to the Christian Broadcasting Network in Virginia Beach, Virginia, United States.  The device was addressed to Reverend Pat Robertson who, at the time, had a television show on the station.  The suspicious package was discovered and subsequently blown up by the police.;1;1;1;0;;.;0;0;0;3;Bombing/Explosion;;.;;.;15;Religious Figures/Institutions;85;Religious Figure;Christian Broadcasting Network;Reverend Pat Robertson;217;United States;;.;;.;;;;.;;.;;.;;;;.;Unknown;;;;;-9;;;;;0;;;-99;-99;0;;.;;;.;;;.;;6;Explosives/Bombs/Dynamite;9;Letter Bomb;;.;;.;;.;;.;;.;;.;Explosive device placed in a six inch package;0;0;0;0;0;0;0;;.;;;0;;;;;;;0;;;;;;;.;;Authorities also believe that this incident was linked to another mail bomb sent to Pat Robertson in 1990 because, in both instances, the explosive devices were similar (199004270007).;"Mike Mather, ""Bomb Squad Destroys Suspicious Package At CBN";;;;;;;;
1,99601E+11;1996;1;20;;0;;217;United States;1;North America;California;Berkeley;37.869885;-122.270539;1;0;;;1;1;1;0;;.;0;0;0;3;Bombing/Explosion;;.;;.;8;Educational Institution;48;Teacher/Professor/Instructor;;Berkeley Professor;217;United States;;.;;.;;;;.;;.;;.;;;;.;Unknown;;;;;-9;;;;;0;;;;;;;.;;;.;;;.;;6;Explosives/Bombs/Dynamite;16;Unknown Explosive Type;;.;;.;;.;;.;;.;;.;Explosive;0;;;0;;;1;;.;;;0;;;;;;;0;;;;;;;.;;;;;;PGIS;-9;-9;0;-9;
1,99601E+11;1996;1;23;;0;;217;United States;1;North America;Florida;Miami;25.764367;-80.201529;1;0;;;1;1;1;1;2;Other Crime Type;0;1;0;3;Bombing/Explosion;;.;;.;10;Journalists & Media;54;Radio Journalist/Staff/Facility;TV Station: USVN/Radio WTOD;Radio/TV Stations;217;United States;;.;;.;;;;.;;.;;.;;;;.;Unknown;;;;;-9;;;;;0;;;;;;;.;;;.;;;.;;6;Explosives/Bombs/Dynamite;16;Unknown Explosive Type;;.;;.;;.;;.;;.;;.;Explosive;1;1;;0;;;1;;.;;;0;;;;;;;0;;;;;;;.;;;;;;PGIS;-9;-9;0;-9;
1,99604E+11;1996;4;1;;0;;217;United States;1;North America;Washington;Spokane;47.65713;-117.247864;1;0;East Sprague Avenue;"04/01/1996: Two masked men detonated a pipe bomb at a suburban office of The Spokesman-Review newspaper in Spokane Valley, Washington state, United States. In a related attack approximately 15-20 minutes later, two assailants robbed a nearby bank, making political statements during the attack. The attackers left notes at both scenes containing Christian Identity rhetoric and signed ""Phineas Priests."" Authorities report that the first attack was intended to divert attention from the second. The attack at the newspaper office caused no casualties, but shattered windows and doors. In October 1996, authorities arrested three members of the Phineas Priesthood group, Robert Sherman Berry, Charles Harrison Barbee, and Verne Jay Merrell, in connection with the attack.";1;1;1;0;;.;1;1;0;3;Bombing/Explosion;;.;;.;10;Journalists & Media;53;Newspaper Journalist/Staff/Facility;The Spokesman-Review;Office;217;United States;;.;;.;;;;.;;.;;.;;;;.;Phineas Priesthood;;;;;100043;;;;During the bank robbery, the perpetrators shouted that the attack was in retaliation for poor treatment of members of the Freemen Organization.;0;;;3;3;1;5;Note left at scene;;;.;;;.;0;6;Explosives/Bombs/Dynamite;17;Other Explosive Type;;.;;.;;.;;.;;.;;.;;0;0;0;0;0;0;1;3;Minor (likely < $1 million);;The explosion damaged doors and windows.;0;;;;;;;;;;;;;;.;;;"""Extremist Group Suspected in Spokane Bombings,"" The New York Times, April 3, 1996.";Federal Bureau of Investigation, Terrorism in the United States: 1996;"Smith, Brent. ""Pre-incident Indicators of Terrorism Incidents: The Identification of Behavioral, Geographic, and Temporal Patterns of Preparatory Conduct,"" NIJ Report, May 2006.";UMD Miscellaneous;0;0;0;0;1,99604E+11
1,99604E+11;1996;4;1;;0;;217;United States;1;North America;Washington;Spokane Valley;47.65713;-117.247864;1;0;East Sprague Avenue;"04/01/1996: Two masked men armed with a shotgun, a revolver, and a pipe bomb committed armed robbery at a U.S. Bank in Spokane Valley, Washington state, United States. In a related attack approximately 15-20 minutes earlier two assailants detonated a pipe bomb at a nearby newspaper office. The attackers left notes at both scenes containing Christian Identity rhetoric and signed ""Phineas Priests."" Authorities report that the first attack was intended to divert attention from the second. The attack at the bank caused major damage but no casualties";;;;;;;;;;;;;;;;;;;;;;;;;;;;;;;;;;;;;;;;;;;;;;;;;;;;;;;;;;;;;;;;;;;;;;;;;;;;;;;;;;;;;;;;;;;;;;;;;;;;;;;;;;;;;;;;;;;;;;
1,99604E+11;1996;4;12;;0;;217;United States;1;North America;California;Vacaville;38.351355;-121.993429;1;1;Interstate 80;"4/12/1996: Unknown perpetrators placed a pipe bomb in the 1955 Chevrolet truck of Gene Ainslee, a federal mine inspector.  The bomb detonated in the truck while Gene and his wife Rita were driving eastbound on Interstate 80 near Vacaville, California, United States.  Both Ainslees were injured but managed to escape the vehicle before it was engulfed with flames.  Before the incident, the United States Department of Labor office in Vacaville, where Gene Ainslee was employed, received an anonymous phone call stating ""you guys are all (expletive) dead. Timothy McVeigh lives on.""";1;1;1;0;;.;0;1;0;3;Bombing/Explosion;;.;;.;2;Government (General);18;Government Personnel (excluding police, military);Federal employee;Truck of a mine inspector working for the United States department of Labor;217;United States;;.;;.;;;;.;;.;;.;;;;.;Anti-Government Group;;;;;1772;;;;To protest the government and support the beliefs of Timothy McVeigh;0;;;-99;-99;0;;.;;;.;;;.;;6;Explosives/Bombs/Dynamite;16;Unknown Explosive Type;;.;;.;;.;;.;;.;;.;Pipe bomb;0;0;0;2;2;0;1;3;Minor (likely < $1 million);;Vehicle engulfed with flames;0;;;;;;;0;;;;;;;.;;The bomb exploded at 4:30 PM.;"""Solano County: Pipe Bomb Was Cause Of Explosion on I-80,"" San Francisco Chronicle, April 20, 1996.";"Lori Olszewski, ""Blast in Federal Worker's Truck Probed, Phone Threat to His Office Mentioned Oklahoma City Suspect,"" San Francisco Chronicle, April 15, 1996.";"Lori Olszewski, ""Vacaville Bomb Case 'Wide Open,' Federal Worker, Wife Still in Serious Condition,"" San Francisco Chronicle, April 16, 1996.";Hewitt Project;-9;-9;0;-9;
1,99604E+11;1996;4;29;;0;;217;United States;1;North America;Washington;Spokane;47.65878;-117.426047;1;0;;;1;1;1;0;;.;0;1;0;3;Bombing/Explosion;;.;;.;2;Government (General);21;Government Building/Facility/Office;;City Hall;217;United States;;.;;.;;;;.;;.;;.;;;;.;White Extremists;;;;;638;;;;;0;;;;;;;.;;;.;;;.;;6;Explosives/Bombs/Dynamite;16;Unknown Explosive Type;;.;;.;;.;;.;;.;;.;Explosive;0;;;0;;;1;;.;;;0;;;;;;;0;;;;;;;.;;;;;;PGIS;-9;-9;0;-9;
1,99605E+11;1996;5;20;;0;;217;United States;1;North America;Texas;Laredo;27.53052;-99.48005;1;0;;;1;1;1;0;;.;0;1;0;3;Bombing/Explosion;;.;;.;3;Police;22;Police Building (headquarters, station, school);;FBI Offices;217;United States;;.;;.;;;;.;;.;;.;;;;.;Organization 544;;;;;905;;;;;0;;;;;;;.;;;.;;;.;;6;Explosives/Bombs/Dynamite;16;Unknown Explosive Type;;.;;.;;.;;.;;.;;.;Explosive;0;;;0;;;1;;.;;;0;;;;;;;0;;;;;;;.;;;;;;PGIS;0;0;0;0;
1,99605E+11;1996;5;23;;0;;217;United States;1;North America;Idaho;Boise;43.618518;-116.214619;1;0;;;1;1;1;-9;;.;0;1;0;7;Facility/Infrastructure Attack;;.;;.;1;Business;6;Medical/Pharmaceutical;Women's Health Care Clinic;Clinic;217;United States;;.;;.;;;;.;;.;;.;;;;.;Unknown;;;;;-9;;;;;0;;;;;;;.;;;.;;;.;;8;Incendiary;;.;;.;;.;;.;;.;;.;;.;;0;;;0;;;1;3;Minor (likely < $1 million);2000;;0;;;;;;;0;;;;;;;.;;;;;;PGIS;-9;-9;0;-9;
1,99607E+11;1996;7;7;;0;;217;United States;1;North America;Idaho;Boise;43.618518;-116.214619;1;0;;;1;1;1;-9;;.;0;1;0;7;Facility/Infrastructure Attack;;.;;.;5;Abortion Related;40;Clinics;Women's Health Care Clinic;Clinic;217;United States;;.;;.;;;;.;;.;;.;;;;.;Unknown;;;;;-9;;;;;0;;;;;;;.;;;.;;;.;;8;Incendiary;;.;;.;;.;;.;;.;;.;;.;;0;;;0;;;1;3;Minor (likely < $1 million);30000;;0;;;;;;;0;;;;;;;.;;;;;;PGIS;-9;-9;0;-9;
1,99607E+11;1996;7;11;;0;;217;United States;1;North America;Florida;Miami;25.777588;-80.237752;1;0;Little Havana;7/11/1996: Unknown perpetrators threw a firebomb through the window of Centro Vasco, a Cuban restaurant in Miami, Florida, United States.  There were no casualties but the incendiary device ignited a small fire in the restaurant.  Cuban singer Rosita Fornes  was scheduled to perform five shows at Centro Vasco, however, they were subsequently canceled as a result of this incident.;1;1;1;0;;.;0;1;0;7;Facility/Infrastructure Attack;;.;;.;1;Business;;.;Cuban American business hosting a Cuban performer;Centro Vasco, Miami Florida;217;United States;;.;;.;;;;.;;.;;.;;;;.;Cuban Exiles;;;;;10015;;;;To protest Rosita Fornes' planned performance at the Centro Vasco.  Fornes had not disassociated herself from the Castro regime;0;;;-99;-99;0;;.;;;.;;;.;;8;Incendiary;19;Molotov Cocktail/Petrol Bomb;;.;;.;;.;;.;;.;;.;Firebomb consisting of a bottle filled with gasoline thrown through window;0;0;0;0;0;0;1;3;Minor (likely < $1 million);;Small fire;0;;;;;;;0;;;;;;;.;;This incident took place when the Centro Vasco was closed.  The fire was extinguished by the sprinkler system of the restaurant.;"Mireya Navarro, ""Cuban Star Rebuffed In Miami,"" New York Times, September 14, 1996.";"""Firebombing Jeopardizes Show By Cuban Entertainer,"" Miami Herald, July 12, 1996.";"Cynthia Corzo, ""Cuban Entertainer's Appearances at Miami Restaurant Stir Furor,"" Miami Herald, July 10, 1996.";Hewitt Project;1;1;0;1;
1,99607E+11;1996;7;12;;0;;217;United States;1;North America;Washington;Spokane Valley;47.65878;-117.426047;1;0;20 South Pines;"07/12/1996: Two masked men detonated a pipe bomb at a Planned Parenthood office in Spokane Valley, Washington state, United States. In a related attack approximately five minutes later, two assailants robbed a nearby bank. The attackers left a notecontaining Christian Identity rhetoric and signed ""Phineas Priests"" at the Planned Parenthood location. Authorities report that the first attack was intended to divert attention from the second. The attack at the Planned Parenthood caused no casualties, but caused extensive damage to the lobby. In October 1996, authorities arrested three members of the Phineas Priesthood group, Robert Sherman Berry, Charles Harrison Barbee, and Verne Jay Merrell, in connection with the attack.";1;1;1;0;;.;1;1;0;3;Bombing/Explosion;;.;;.;5;Abortion Related;40;Clinics;Planned Parenthood;Office;217;United States;;.;;.;;;;.;;.;;.;;;;.;Phineas Priesthood;;;;;100043;;;;;0;;;4;4;1;5;Note left at scene;;;.;;;.;0;6;Explosives/Bombs/Dynamite;17;Other Explosive Type;;.;;.;;.;;.;;.;;.;Pipe bomb wrapped in #4 shot;0;0;0;0;0;0;1;3;Minor (likely < $1 million);;The explosion caused extensive destruction to the lobby.;0;;;;;;;;;;;;;;.;;;"""Bank Robbery Follows Bombing";;;;;;;;
1,99607E+11;1996;7;12;;0;;217;United States;1;North America;Washington;Spokane Valley;47.65878;-117.426047;1;0;East Sprague Avenue;"07/12/1996: Two masked men armed with firearms and a propane tank rigged to a timer committed armed robbery at a U.S. Bank in Spokane Valley, Washington state, United States. In a related attack approximately five minutes earlier two assailants detonated a pipe bomb at a nearby Planned Parenthood office. The attackers left a note containing Christian Identity rhetoric and signed ""Phineas Priests"" at the Planned Parenthood location. Authorities report that the first attack was intended to divert attention from the second. The attack at the bank caused no damage or casualties, but the perpetrators escaped with $32,666. In October 1996, authorities arrested three members of the Phineas Priesthood group, Robert Sherman Berry, Charles Harrison Barbee, and Verne Jay Merrell, in connection with these attacks. In March 1997, a fourth group member, Brian Ratigan, was arrested in connection with these attacks.";1;1;1;0;;.;1;1;0;2;Armed Assault;;.;;.;1;Business;3;Bank/Commerce;U.S. Bank;Branch;217;United States;;.;;.;;;;.;;.;;.;;;;.;Phineas Priesthood;;;;;100043;;;;;0;;;4;4;0;;.;;;.;;;.;;5;Firearms;2;Automatic Weapon;5;Firearms;4;Rifle/Shotgun (non-automatic);6;Explosives/Bombs/Dynamite;17;Other Explosive Type;;.;;.;AK-47;;;;;;;;;;;;;;;;;;;;;;;;;;;;;;;;;;;;;
1,99607E+11;1996;7;17;;0;;217;United States;1;North America;New York;New York City;40.712784;-74.005941;1;0;;;1;1;1;0;;.;0;1;0;3;Bombing/Explosion;;.;;.;15;Religious Figures/Institutions;86;Place of Worship;;Synagogue;217;United States;;.;;.;;;;.;;.;;.;;;;.;Unknown;;;;;-9;;;;;0;;;;;;;.;;;.;;;.;;6;Explosives/Bombs/Dynamite;16;Unknown Explosive Type;;.;;.;;.;;.;;.;;.;Explosive;0;;;0;;;1;;.;;;0;;;;;;;0;;;;;;;.;;;;;;PGIS;-9;-9;0;-9;
1,99607E+11;1996;7;22;;0;;217;United States;1;North America;Florida;Miami;25.764367;-80.201529;1;0;;;1;1;1;0;;.;0;1;0;7;Facility/Infrastructure Attack;;.;;.;22;Violent Political Party;110;Party Office/Facility;Sandinista National Liberation Front (FSLN);Office;145;Nicaragua;;.;;.;;;;.;;.;;.;;;;.;Unknown;;;;;-9;;;;;0;;;;;;;.;;;.;;;.;;8;Incendiary;;.;;.;;.;;.;;.;;.;;.;;0;;;0;;;1;;.;;;0;;;;;;;0;;;;;;;.;;;;;;PGIS;-9;-9;1;1;
1,99607E+11;1996;7;27;;0;;217;United States;1;North America;Georgia;Atlanta;33.748315;-84.391109;1;0;;;1;1;1;0;;.;0;1;0;3;Bombing/Explosion;;.;;.;14;Private Citizens & Property;78;Procession/Gathering (funeral, wedding, birthday, religious);;Olympic Games;217;United States;;.;;.;;;;.;;.;;.;;;;.;Army of God;;;;;10054;;;;;0;;;;;;;.;;;.;;;.;;6;Explosives/Bombs/Dynamite;16;Unknown Explosive Type;;.;;.;;.;;.;;.;;.;Explosive;1;1;;110;75;;1;;.;;;0;;;;;;;0;;;;;;;.;;;;;;PGIS;0;0;0;0;
1,99608E+11;1996;8;16;;0;;217;United States;1;North America;Utah;West Jordan;40.60675;-111.938754;1;0;The incident occurred at a McDonald's nearing completion of construction at 1250 W and 9000 S.;8/16/1996: Four animal-rights activists used a molotov cocktail and gasoline to set fire to a McDonald's fast food restaurant in West Jordan, Utah in the United States.  There were no injuries in the incident, which destroyed about 80% of the building under construction, which was nearing completion, causing at least $240,000 in damage.  In 2007, Mark Klein, Ryan Durfee, and Jason Troff were each sentenced to a year in prison after admitting their responsibility in the incident.  A fourth perpetrator was a 17-year old juvenile whose record was not released, was also charged in the incident after confessing, and then sentenced to probation.;1;1;1;0;;.;0;1;0;7;Facility/Infrastructure Attack;;.;;.;1;Business;2;Restaurant/Bar/Café;McDonald's fast food restaurants;McDonald's fast food restaurant in West Jordan, UT;217;United States;;.;;.;;;;.;;.;;.;;;;.;Unaffiliated Individual(s);;;;;20202;;;;"Allegedly, in protest of animal cruelty and ""the slaughter of cattle, chickens and fish.""";0;;;4;4;0;;.;;;.;;;.;;8;Incendiary;19;Molotov Cocktail/Petrol Bomb;;.;;.;;.;;.;;.;;.;molotov cocktail and gasoline poured on the building;0;0;0;0;0;0;1;3;Minor (likely < $1 million);240000;building burned down and completely destroyed;0;;;;;;;0;;;;;;;.;;The incident occurred just before 2:00am. Some sources indicate damage may have been as high as $400,000.  The perpetrators denied any involvement in underground animal rights organizations such as ALF.;"Mark L. Reece, ""2-Alarm Fire Burns 80% of a McDonald's,"" Deseret News, August 17, 1996.";"Don Rosebrock, ""Animal-rights Activist is Jailed,"" Deseret News, October 20, 1997.";"Tom Zoellner, ""Eatery Fire Traced To Animal Activists";;;;;;
1,99608E+11;1996;8;24;;0;;217;United States;1;North America;Ohio;Akron;41.084195;-81.514059;1;0;;;1;1;1;1;2;Other Crime Type;0;1;0;3;Bombing/Explosion;;.;;.;14;Private Citizens & Property;78;Procession/Gathering (funeral, wedding, birthday, religious);;NEC World Series Golf Tournament;217;United States;;.;;.;;;;.;;.;;.;;;;.;Unknown;;;;;-9;;;;;0;;;;;;;.;;;.;;;.;;6;Explosives/Bombs/Dynamite;16;Unknown Explosive Type;;.;;.;;.;;.;;.;;.;Explosive;0;;;3;3;;1;;.;;;0;;;;;;;0;;;;;;;.;;;;;;PGIS;-9;-9;0;-9;
1,99608E+11;1996;8;31;;0;;217;United States;1;North America;Tennessee;Piperton;35.04819;-89.620111;1;0;at RusDun Farms Inc. in Piperton, Tennessee;8/31/1996: The Animal Liberation Front (ALF) claimed responsibility for planting four incendiary devices in trucks and the loading dock area of the RusDun Farms Inc. in Piperton, Tennessee in the United States. Only one of the firebombs ignited, causing damage to one of the trucks.  The group also said that they sabotaged warehouse air conditioner units.  The extent of monetary property damage is unknown.  There were no casualties in the incident.  ALF sent out a communiqué by fax to various news organizations, stating the group committed the attack on ''behalf of more than a half-million chickens imprisoned and in forced labor at the factory farm.'';1;1;1;0;;.;0;1;0;7;Facility/Infrastructure Attack;;.;;.;1;Business;9;Farm/Ranch;RusDun Farms Inc.;egg farm in Piperton, TN;217;United States;;.;;.;;;;.;;.;;.;;;;.;Animal Liberation Front (ALF);;;;;291;;;;"The perpetrators committed the incident on ""behalf of more than a half-million chickens imprisoned and in forced labor at the factory farm.''";0;;;-99;-99;1;1;Letter;;;.;;;.;;8;Incendiary;20;Gasoline or Alcohol;;.;;.;;.;;.;;.;;.;;0;0;0;0;0;0;1;4;Unknown;;one truck damaged;0;;;;;;;0;;;;;;;.;;;"Tom Charlier, ""Fayette Egg Farm Firebombed";;;;;;;;
1,99609E+11;1996;9;1;;0;;217;United States;1;North America;Oklahoma;Broken Arrow;36.050845;-95.789504;1;0;;;1;1;1;0;;.;0;1;0;3;Bombing/Explosion;;.;;.;5;Abortion Related;40;Clinics;Planned Parenthood of E. Oklahoma + W. Arkansas;Clinic;217;United States;;.;;.;;;;.;;.;;.;;;;.;Unaffiliated Individual(s);;;;;20202;;;;;0;;;;;;;.;;;.;;;.;;6;Explosives/Bombs/Dynamite;16;Unknown Explosive Type;;.;;.;;.;;.;;.;;.;Explosive;0;;;0;;;1;3;Minor (likely < $1 million);1000;;0;;;;;;;0;;;;;;;.;;;;;;PGIS;-9;-9;0;-9;
1,99609E+11;1996;9;10;;0;;217;United States;1;North America;Arizona;Tempe;33.42551;-111.937419;1;0;;;1;1;1;-9;;.;0;1;0;8;Unarmed Assault;;.;;.;5;Abortion Related;40;Clinics;Planned Parenthood;Clinic;217;United States;;.;;.;;;;.;;.;;.;;;;.;Unaffiliated Individual(s);;;;;20202;;;;;0;;;1;;;;.;;;.;;;.;;9;Melee;21;Blunt Object;;.;;.;;.;;.;;.;;.;Club;0;;;0;;;1;;.;;;0;;;;;;;0;;;;;;;.;;;;;;PGIS;-9;-9;0;-9;
1,99609E+11;1996;9;18;;0;;217;United States;1;North America;Oklahoma;Broken Arrow;36.050845;-95.789504;1;0;Device ignited at rear of building;9/18/1996: A juvenile (whose name was not released by authorities) threw a Molotov cocktail at the Planned Parenthood of Eastern Oklahoma and Western Arkansas Broken Arrow Family Planning clinic in Oklahoma, United States.  There were no casualties but the abortion clinic was damaged.;1;1;1;0;;.;0;1;0;7;Facility/Infrastructure Attack;;.;;.;5;Abortion Related;40;Clinics;;Planned Parenthood of Eastern Oklahoma and Western Arkansas Broken Arrow Family Planning clinic;217;United States;;.;;.;;;;.;;.;;.;;;;.;Anti-Abortion Activists;;;;;1470;;;;To protest the practice of abortion and to sabotage abortion facilities operating in Oklahoma.;0;;;1;1;0;;.;;;.;;;.;;8;Incendiary;19;Molotov Cocktail/Petrol Bomb;;.;;.;;.;;.;;.;;.;Molotov cocktail;0;0;0;0;0;0;1;3;Minor (likely < $1 million);;Rear of facility damaged;0;;;;;;;0;;;;;;;.;;Three days, the same perpetrator threw a Molotov cocktail into the same abortion clinic (199609010001).  The perpetrator claimed these two incidents as well as two other attacks against abortion clinics in the Tulsa area in a tape released to authorities (199701010006 and 199701190010).;"""F.B.I. Joins Bombing Inquiry At Abortion Clinic in Tulsa,"" New York Times, January 21, 1997.";"""Oklahoma Abortion Clinic Reopens After Bomb Attack,"" Lawrence Journal-World, January 22, 1997.";;Anti-Abortion Project 2010;-9;-9;0;-9;
1,9961E+11;1996;10;3;;0;;217;United States;1;North America;California;Lancaster;34.698905;-118.144779;1;0;1255 W. Avenue I;10/3/1996: Geoffrey Barr bombed the Back Door Bar, a gay establishment, in Lancaster, California, United States.  One person was injured and the bar sustained minor damage.;1;1;1;1;2;Other Crime Type;0;1;0;3;Bombing/Explosion;;.;;.;1;Business;2;Restaurant/Bar/Café;Gay establishment;Back Door Bar, Lancaster California;217;United States;;.;;.;;;;.;;.;;.;;;;.;White Extremists;;;;;638;;;;Hatred of homosexuals.;0;;;1;1;0;;.;;;.;;;.;;6;Explosives/Bombs/Dynamite;16;Unknown Explosive Type;;.;;.;;.;;.;;.;;.;Explosive device;0;0;0;1;1;0;1;3;Minor (likely < $1 million);;Ceiling damaged and displays knocked off cases;0;;;;;;;0;;;;;;;.;;The incident took place at 9:00 PM.  Geoffrey Barr was also convicted of stealing tools and smoke grenades from Edwards Air Force Base in California.;"""Lancaster Man Sentenced to Prison for Bombing Gay Bar,"" City News Service, June 13, 1997.";"Jose Cardenas, ""Son Charged With Bombing, Gay Bar";;;;;;;
